[
  {"phase":43,"protocol_version":"agent-pay/v2","upstream_protocol":"atf/v2","case_id":"phase-43-01-all_v2_gates_green","rule":"all_v2_gates_green","expected_decision":"ALLOW"},
  {"phase":43,"protocol_version":"agent-pay/v2","upstream_protocol":"atf/v2","case_id":"phase-43-02-protocol_frozen","rule":"protocol_frozen","expected_decision":"ALLOW"},
  {"phase":43,"protocol_version":"agent-pay/v2","upstream_protocol":"atf/v2","case_id":"phase-43-03-final_vectors_green","rule":"final_vectors_green","expected_decision":"ALLOW"},
  {"phase":43,"protocol_version":"agent-pay/v2","upstream_protocol":"atf/v2","case_id":"phase-43-04-security_gate_green","rule":"security_gate_green","expected_decision":"ALLOW"},
  {"phase":43,"protocol_version":"agent-pay/v2","upstream_protocol":"atf/v2","case_id":"phase-43-05-release_evidence_complete","rule":"release_evidence_complete","expected_decision":"ALLOW"},
  {"phase":43,"protocol_version":"agent-pay/v2","upstream_protocol":"atf/v2","case_id":"phase-43-negative-fail-closed","rule":"fail-closed","expected_decision":"DENY"}
]
